{
  "schema_version": "1.0.0",
  "artifact_version": "derived-parameter-screen-0.1.0",
  "generated_at": "2026-09-08T17:29:22+00:00",
  "source_release": "private-sector-study-1.60.0",
  "status": "descriptive_derived_data_complete_no_calibration_authorized",
  "policy": {
    "reported_actual_only": true,
    "same_project_year_required": true,
    "exact_scope_identity_required": true,
    "independent_project_minimum": 3,
    "repeated_years_collapsed_to_project_medians": true,
    "leave_one_project_out_required_for_future_estimation": true
  },
  "counts": {
    "parameter_definitions": 12,
    "derived_observations": 235,
    "calibration_authorized_parameters": 0,
    "status_counts": {
      "blocked_insufficient_independent_projects": 7,
      "descriptive_only_jurisdiction_specific": 5
    }
  },
  "parameters": [
    {
      "parameter_code": "effective_tax_paid_per_account_assessed_value",
      "label": "Property taxes paid per dollar of account assessed value",
      "numerator_metric_code": "study.property_taxes_paid",
      "denominator_metric_code": "study.account_assessed_value",
      "unit": "ratio",
      "transferability": "jurisdiction_specific",
      "match_policy": "same_project_year_exact_scope_label_level_county_and_inventory_allocation",
      "observation_count": 82,
      "project_count": 11,
      "project_ids": [
        "prj_study_im3_building_00300974499",
        "prj_study_im3_building_00472761713",
        "prj_study_im3_building_00499403180",
        "prj_study_im3_building_00500820007",
        "prj_study_im3_building_00598261190",
        "prj_study_im3_building_00838817907",
        "prj_study_im3_building_00844371952",
        "prj_study_im3_building_00978934687",
        "prj_study_im3_building_01073720208",
        "prj_study_im3_campus_00578435601",
        "prj_study_im3_point_06685432442"
      ],
      "ambiguous_match_count": 0,
      "project_median_distribution": {
        "minimum": 0.009359629075,
        "p25": 0.011296707304,
        "median": 0.02064,
        "p75": 0.032986920797,
        "maximum": 0.118668000045
      },
      "calibration_status": "descriptive_only_jurisdiction_specific",
      "calibration_authorized": false,
      "screening_reason": "The ratio is derived reproducibly, but tax rates and assessment bases are jurisdiction-specific and cannot be transferred across projects as a national parameter."
    },
    {
      "parameter_code": "effective_tax_billed_per_account_assessed_value",
      "label": "Property taxes billed per dollar of account assessed value",
      "numerator_metric_code": "study.property_taxes_billed",
      "denominator_metric_code": "study.account_assessed_value",
      "unit": "ratio",
      "transferability": "jurisdiction_specific",
      "match_policy": "same_project_year_exact_scope_label_level_county_and_inventory_allocation",
      "observation_count": 49,
      "project_count": 10,
      "project_ids": [
        "prj_study_im3_building_00300974499",
        "prj_study_im3_building_00472761713",
        "prj_study_im3_building_00598261190",
        "prj_study_im3_building_00838817907",
        "prj_study_im3_building_00844371952",
        "prj_study_im3_building_00978934687",
        "prj_study_im3_building_01073720208",
        "prj_study_im3_campus_00231769626",
        "prj_study_im3_campus_00578435601",
        "prj_study_im3_point_06685432442"
      ],
      "ambiguous_match_count": 0,
      "project_median_distribution": {
        "minimum": 0.00198656662,
        "p25": 0.012200924174,
        "median": 0.018050749927,
        "p75": 0.033428381002,
        "maximum": 0.118668000045
      },
      "calibration_status": "descriptive_only_jurisdiction_specific",
      "calibration_authorized": false,
      "screening_reason": "The ratio is derived reproducibly, but tax rates and assessment bases are jurisdiction-specific and cannot be transferred across projects as a national parameter."
    },
    {
      "parameter_code": "effective_tax_paid_per_taxable_assessed_value",
      "label": "Property taxes paid per dollar of taxable assessed value",
      "numerator_metric_code": "study.property_taxes_paid",
      "denominator_metric_code": "study.taxable_assessed_value",
      "unit": "ratio",
      "transferability": "jurisdiction_specific",
      "match_policy": "same_project_year_exact_scope_label_level_county_and_inventory_allocation",
      "observation_count": 0,
      "project_count": 0,
      "project_ids": [],
      "ambiguous_match_count": 0,
      "project_median_distribution": null,
      "calibration_status": "blocked_insufficient_independent_projects",
      "calibration_authorized": false,
      "screening_reason": "Fewer than three independent projects have an unambiguous same-year, exact-scope numerator and denominator."
    },
    {
      "parameter_code": "effective_tax_billed_per_taxable_assessed_value",
      "label": "Property taxes billed per dollar of taxable assessed value",
      "numerator_metric_code": "study.property_taxes_billed",
      "denominator_metric_code": "study.taxable_assessed_value",
      "unit": "ratio",
      "transferability": "jurisdiction_specific",
      "match_policy": "same_project_year_exact_scope_label_level_county_and_inventory_allocation",
      "observation_count": 2,
      "project_count": 2,
      "project_ids": [
        "prj_study_im3_building_00397914434",
        "prj_study_im3_campus_00019988712"
      ],
      "ambiguous_match_count": 0,
      "project_median_distribution": {
        "minimum": 0.015709999495,
        "p25": 0.015730699438,
        "median": 0.015751399381,
        "p75": 0.015772099324,
        "maximum": 0.015792799267
      },
      "calibration_status": "blocked_insufficient_independent_projects",
      "calibration_authorized": false,
      "screening_reason": "Fewer than three independent projects have an unambiguous same-year, exact-scope numerator and denominator."
    },
    {
      "parameter_code": "effective_tax_paid_per_appraised_value",
      "label": "Property taxes paid per dollar of appraised value",
      "numerator_metric_code": "study.property_taxes_paid",
      "denominator_metric_code": "study.appraised_property_value",
      "unit": "ratio",
      "transferability": "jurisdiction_specific",
      "match_policy": "same_project_year_exact_scope_label_level_county_and_inventory_allocation",
      "observation_count": 45,
      "project_count": 3,
      "project_ids": [
        "prj_study_im3_building_00598261190",
        "prj_study_im3_building_00844371952",
        "prj_study_im3_point_09190480200"
      ],
      "ambiguous_match_count": 0,
      "project_median_distribution": {
        "minimum": 0.002600000216,
        "p25": 0.012640999775,
        "median": 0.022681999334,
        "p75": 0.026174500329,
        "maximum": 0.029667001323
      },
      "calibration_status": "descriptive_only_jurisdiction_specific",
      "calibration_authorized": false,
      "screening_reason": "The ratio is derived reproducibly, but tax rates and assessment bases are jurisdiction-specific and cannot be transferred across projects as a national parameter."
    },
    {
      "parameter_code": "effective_tax_billed_per_appraised_value",
      "label": "Property taxes billed per dollar of appraised value",
      "numerator_metric_code": "study.property_taxes_billed",
      "denominator_metric_code": "study.appraised_property_value",
      "unit": "ratio",
      "transferability": "jurisdiction_specific",
      "match_policy": "same_project_year_exact_scope_label_level_county_and_inventory_allocation",
      "observation_count": 34,
      "project_count": 4,
      "project_ids": [
        "prj_study_im3_building_00598261190",
        "prj_study_im3_building_00844371952",
        "prj_study_im3_building_00844389014",
        "prj_study_im3_campus_00578435601"
      ],
      "ambiguous_match_count": 0,
      "project_median_distribution": {
        "minimum": 0.0,
        "p25": 0.0,
        "median": 0.001506270119,
        "p75": 0.009676155509,
        "maximum": 0.029667001323
      },
      "calibration_status": "descriptive_only_jurisdiction_specific",
      "calibration_authorized": false,
      "screening_reason": "The ratio is derived reproducibly, but tax rates and assessment bases are jurisdiction-specific and cannot be transferred across projects as a national parameter."
    },
    {
      "parameter_code": "effective_tax_paid_per_taxable_property_value",
      "label": "Property taxes paid per dollar of taxable property value",
      "numerator_metric_code": "study.property_taxes_paid",
      "denominator_metric_code": "study.taxable_property_value",
      "unit": "ratio",
      "transferability": "jurisdiction_specific",
      "match_policy": "same_project_year_exact_scope_label_level_county_and_inventory_allocation",
      "observation_count": 23,
      "project_count": 4,
      "project_ids": [
        "prj_study_im3_building_00377585075",
        "prj_study_im3_building_00610827836",
        "prj_study_im3_building_01073720208",
        "prj_study_im3_point_06685432442"
      ],
      "ambiguous_match_count": 36,
      "project_median_distribution": {
        "minimum": 0.003275870176,
        "p25": 0.012145866279,
        "median": 0.026389778382,
        "p75": 0.045147208547,
        "maximum": 0.067557758837
      },
      "calibration_status": "descriptive_only_jurisdiction_specific",
      "calibration_authorized": false,
      "screening_reason": "The ratio is derived reproducibly, but tax rates and assessment bases are jurisdiction-specific and cannot be transferred across projects as a national parameter."
    },
    {
      "parameter_code": "electricity_use_per_operating_mw",
      "label": "Annual electricity use per operating MW",
      "numerator_metric_code": "study.annual_electricity_use",
      "denominator_metric_code": "study.operating_power_capacity",